<?xml version="1.0" encoding="UTF-8" standalone="no" ?>
<room xmlns:xsi="http://www.w3.org/2001/XMLSchema-instance" xsi:noNamespaceSchemaLocation="room.xsd">

  <name>penitentiary/penitentiary24.xml</name>

  <scenery>penitentiary</scenery>

  <xTiles>9</xTiles>

  <yTiles>9</yTiles>

  <width>16</width>

  <floorType>none</floorType>

  <floor>
    <tile>
      <x>0</x>
      <y>1</y>
      <offsetX>0</offsetX>
      <offsetY>0</offsetY>
      <bitmap>gfx/penitentiary/penitentiary-floor-underground-north.bmp</bitmap>
    </tile>
    <tile>
      <x>0</x>
      <y>2</y>
      <offsetX>0</offsetX>
      <offsetY>0</offsetY>
      <bitmap>gfx/penitentiary/penitentiary-floor-underground-north.bmp</bitmap>
    </tile>
    <tile>
      <x>0</x>
      <y>3</y>
      <offsetX>0</offsetX>
      <offsetY>0</offsetY>
      <bitmap>gfx/penitentiary/penitentiary-floor-underground-north.bmp</bitmap>
    </tile>
    <tile>
      <x>0</x>
      <y>4</y>
      <offsetX>0</offsetX>
      <offsetY>0</offsetY>
      <bitmap>gfx/penitentiary/penitentiary-floor-underground-north.bmp</bitmap>
    </tile>
    <tile>
      <x>0</x>
      <y>5</y>
      <offsetX>0</offsetX>
      <offsetY>0</offsetY>
      <bitmap>gfx/penitentiary/penitentiary-floor-underground-north.bmp</bitmap>
    </tile>
    <tile>
      <x>0</x>
      <y>6</y>
      <offsetX>0</offsetX>
      <offsetY>0</offsetY>
      <bitmap>gfx/penitentiary/penitentiary-floor-underground-north.bmp</bitmap>
    </tile>
    <tile>
      <x>0</x>
      <y>7</y>
      <offsetX>0</offsetX>
      <offsetY>0</offsetY>
      <bitmap>gfx/penitentiary/penitentiary-floor-underground-north.bmp</bitmap>
    </tile>
    <tile>
      <x>0</x>
      <y>8</y>
      <offsetX>0</offsetX>
      <offsetY>0</offsetY>
      <bitmap>gfx/penitentiary/penitentiary-floor-underground-north.bmp</bitmap>
    </tile>
    <tile>
      <x>4</x>
      <y>0</y>
      <offsetX>0</offsetX>
      <offsetY>0</offsetY>
      <bitmap>gfx/penitentiary/penitentiary-floor-east.bmp</bitmap>
    </tile>
    <tile>
      <x>5</x>
      <y>0</y>
      <offsetX>0</offsetX>
      <offsetY>0</offsetY>
      <bitmap>gfx/penitentiary/penitentiary-floor-east.bmp</bitmap>
    </tile>
    <tile>
      <x>1</x>
      <y>0</y>
      <offsetX>0</offsetX>
      <offsetY>0</offsetY>
      <bitmap>gfx/penitentiary/penitentiary-floor-underground-east.bmp</bitmap>
    </tile>
    <tile>
      <x>2</x>
      <y>0</y>
      <offsetX>0</offsetX>
      <offsetY>0</offsetY>
      <bitmap>gfx/penitentiary/penitentiary-floor-underground-east.bmp</bitmap>
    </tile>
    <tile>
      <x>3</x>
      <y>0</y>
      <offsetX>0</offsetX>
      <offsetY>0</offsetY>
      <bitmap>gfx/penitentiary/penitentiary-floor-underground-east.bmp</bitmap>
    </tile>
    <tile>
      <x>6</x>
      <y>0</y>
      <offsetX>0</offsetX>
      <offsetY>0</offsetY>
      <bitmap>gfx/penitentiary/penitentiary-floor-underground-east.bmp</bitmap>
    </tile>
    <tile>
      <x>7</x>
      <y>0</y>
      <offsetX>0</offsetX>
      <offsetY>0</offsetY>
      <bitmap>gfx/penitentiary/penitentiary-floor-underground-east.bmp</bitmap>
    </tile>
    <tile>
      <x>8</x>
      <y>0</y>
      <offsetX>0</offsetX>
      <offsetY>0</offsetY>
      <bitmap>gfx/penitentiary/penitentiary-floor-underground-east.bmp</bitmap>
    </tile>
    <tile>
      <x>8</x>
      <y>1</y>
      <offsetX>0</offsetX>
      <offsetY>0</offsetY>
      <bitmap>gfx/penitentiary/penitentiary-nofloor-south.bmp</bitmap>
    </tile>
    <tile>
      <x>8</x>
      <y>2</y>
      <offsetX>0</offsetX>
      <offsetY>0</offsetY>
      <bitmap>gfx/penitentiary/penitentiary-nofloor-south.bmp</bitmap>
    </tile>
    <tile>
      <x>8</x>
      <y>3</y>
      <offsetX>0</offsetX>
      <offsetY>0</offsetY>
      <bitmap>gfx/penitentiary/penitentiary-nofloor-south.bmp</bitmap>
    </tile>
    <tile>
      <x>8</x>
      <y>4</y>
      <offsetX>0</offsetX>
      <offsetY>0</offsetY>
      <bitmap>gfx/penitentiary/penitentiary-nofloor-south.bmp</bitmap>
    </tile>
    <tile>
      <x>8</x>
      <y>5</y>
      <offsetX>0</offsetX>
      <offsetY>0</offsetY>
      <bitmap>gfx/penitentiary/penitentiary-nofloor-south.bmp</bitmap>
    </tile>
    <tile>
      <x>8</x>
      <y>6</y>
      <offsetX>0</offsetX>
      <offsetY>0</offsetY>
      <bitmap>gfx/penitentiary/penitentiary-nofloor-south.bmp</bitmap>
    </tile>
    <tile>
      <x>8</x>
      <y>7</y>
      <offsetX>0</offsetX>
      <offsetY>0</offsetY>
      <bitmap>gfx/penitentiary/penitentiary-nofloor-south.bmp</bitmap>
    </tile>
    <tile>
      <x>1</x>
      <y>8</y>
      <offsetX>0</offsetX>
      <offsetY>0</offsetY>
      <bitmap>gfx/penitentiary/penitentiary-nofloor-west.bmp</bitmap>
    </tile>
    <tile>
      <x>2</x>
      <y>8</y>
      <offsetX>0</offsetX>
      <offsetY>0</offsetY>
      <bitmap>gfx/penitentiary/penitentiary-nofloor-west.bmp</bitmap>
    </tile>
    <tile>
      <x>3</x>
      <y>8</y>
      <offsetX>0</offsetX>
      <offsetY>0</offsetY>
      <bitmap>gfx/penitentiary/penitentiary-nofloor-west.bmp</bitmap>
    </tile>
    <tile>
      <x>4</x>
      <y>8</y>
      <offsetX>0</offsetX>
      <offsetY>0</offsetY>
      <bitmap>gfx/penitentiary/penitentiary-nofloor-west.bmp</bitmap>
    </tile>
    <tile>
      <x>5</x>
      <y>8</y>
      <offsetX>0</offsetX>
      <offsetY>0</offsetY>
      <bitmap>gfx/penitentiary/penitentiary-nofloor-west.bmp</bitmap>
    </tile>
    <tile>
      <x>6</x>
      <y>8</y>
      <offsetX>0</offsetX>
      <offsetY>0</offsetY>
      <bitmap>gfx/penitentiary/penitentiary-nofloor-west.bmp</bitmap>
    </tile>
    <tile>
      <x>7</x>
      <y>8</y>
      <offsetX>0</offsetX>
      <offsetY>0</offsetY>
      <bitmap>gfx/penitentiary/penitentiary-nofloor-west.bmp</bitmap>
    </tile>
    <tile>
      <x>8</x>
      <y>8</y>
      <offsetX>0</offsetX>
      <offsetY>0</offsetY>
      <bitmap>gfx/penitentiary/penitentiary-nofloor-sw.bmp</bitmap>
    </tile>
  </floor>

  <items>
    <item x="0" y="1" z="0">
      <label>291</label>
      <direction>none</direction>
      <behavior>0</behavior>
      <type>griditem</type>
    </item>
    <item x="0" y="2" z="0">
      <label>291</label>
      <direction>none</direction>
      <behavior>0</behavior>
      <type>griditem</type>
    </item>
    <item x="0" y="3" z="0">
      <label>293</label>
      <direction>none</direction>
      <behavior>0</behavior>
      <type>griditem</type>
    </item>
    <item x="0" y="4" z="0">
      <label>291</label>
      <direction>none</direction>
      <behavior>0</behavior>
      <type>griditem</type>
    </item>
    <item x="0" y="5" z="0">
      <label>291</label>
      <direction>none</direction>
      <behavior>0</behavior>
      <type>griditem</type>
    </item>
    <item x="0" y="6" z="0">
      <label>293</label>
      <direction>none</direction>
      <behavior>0</behavior>
      <type>griditem</type>
    </item>
    <item x="0" y="7" z="0">
      <label>291</label>
      <direction>none</direction>
      <behavior>0</behavior>
      <type>griditem</type>
    </item>
    <item x="0" y="8" z="0">
      <label>291</label>
      <direction>none</direction>
      <behavior>0</behavior>
      <type>griditem</type>
    </item>
    <item x="1" y="0" z="0">
      <label>290</label>
      <direction>none</direction>
      <behavior>0</behavior>
      <type>griditem</type>
    </item>
    <item x="2" y="0" z="0">
      <label>292</label>
      <direction>none</direction>
      <behavior>0</behavior>
      <type>griditem</type>
    </item>
    <item x="3" y="0" z="0">
      <label>290</label>
      <direction>none</direction>
      <behavior>0</behavior>
      <type>griditem</type>
    </item>
    <item x="6" y="0" z="0">
      <label>290</label>
      <direction>none</direction>
      <behavior>0</behavior>
      <type>griditem</type>
    </item>
    <item x="7" y="0" z="0">
      <label>292</label>
      <direction>none</direction>
      <behavior>0</behavior>
      <type>griditem</type>
    </item>
    <item x="8" y="0" z="0">
      <label>290</label>
      <direction>none</direction>
      <behavior>0</behavior>
      <type>griditem</type>
    </item>
    <item x="4" y="0" z="-1">
      <label>297</label>
      <direction>none</direction>
      <behavior>0</behavior>
      <type>griditem</type>
    </item>
    <item x="5" y="0" z="-1">
      <label>297</label>
      <direction>none</direction>
      <behavior>0</behavior>
      <type>griditem</type>
    </item>
    <item x="4" y="0" z="-1">
      <label>5066</label>
      <direction>east</direction>
      <behavior>0</behavior>
      <type>door</type>
    </item>
    <item x="4" y="5" z="0">
      <label>31</label>
      <direction>none</direction>
      <behavior>6</behavior>
      <type>freeitem</type>
      <extra>6</extra>
      <extra>0</extra>
      <extra>1</extra>
    </item>
  </items>

</room>
