<?xml version="1.0" encoding="UTF-8" standalone="no" ?>
<room xmlns:xsi="http://www.w3.org/2001/XMLSchema-instance" xsi:noNamespaceSchemaLocation="room.xsd">

  <name>safari/safari11.xml</name>

  <scenery>safari</scenery>

  <xTiles>8</xTiles>

  <yTiles>6</yTiles>

  <width>16</width>

  <floorType>regular</floorType>

  <floor>
    <tile>
      <x>0</x>
      <y>2</y>
      <offsetX>0</offsetX>
      <offsetY>0</offsetY>
      <bitmap>gfx/safari/safari-floor-north.bmp</bitmap>
    </tile>
    <tile>
      <x>0</x>
      <y>3</y>
      <offsetX>0</offsetX>
      <offsetY>0</offsetY>
      <bitmap>gfx/safari/safari-floor-north.bmp</bitmap>
    </tile>
    <tile>
      <x>7</x>
      <y>0</y>
      <offsetX>0</offsetX>
      <offsetY>0</offsetY>
      <bitmap>gfx/safari/safari-floor-south.bmp</bitmap>
    </tile>
    <tile>
      <x>7</x>
      <y>1</y>
      <offsetX>0</offsetX>
      <offsetY>0</offsetY>
      <bitmap>gfx/safari/safari-floor-south.bmp</bitmap>
    </tile>
    <tile>
      <x>7</x>
      <y>2</y>
      <offsetX>0</offsetX>
      <offsetY>0</offsetY>
      <bitmap>gfx/safari/safari-floor-south.bmp</bitmap>
    </tile>
    <tile>
      <x>7</x>
      <y>3</y>
      <offsetX>0</offsetX>
      <offsetY>0</offsetY>
      <bitmap>gfx/safari/safari-floor-south.bmp</bitmap>
    </tile>
    <tile>
      <x>7</x>
      <y>4</y>
      <offsetX>0</offsetX>
      <offsetY>0</offsetY>
      <bitmap>gfx/safari/safari-floor-south.bmp</bitmap>
    </tile>
    <tile>
      <x>7</x>
      <y>5</y>
      <offsetX>0</offsetX>
      <offsetY>0</offsetY>
      <bitmap>gfx/safari/safari-floor-south.bmp</bitmap>
    </tile>
    <tile>
      <x>1</x>
      <y>0</y>
      <offsetX>0</offsetX>
      <offsetY>0</offsetY>
      <bitmap>gfx/safari/safari-floor.bmp</bitmap>
    </tile>
    <tile>
      <x>1</x>
      <y>1</y>
      <offsetX>0</offsetX>
      <offsetY>0</offsetY>
      <bitmap>gfx/safari/safari-floor.bmp</bitmap>
    </tile>
    <tile>
      <x>1</x>
      <y>2</y>
      <offsetX>0</offsetX>
      <offsetY>0</offsetY>
      <bitmap>gfx/safari/safari-floor.bmp</bitmap>
    </tile>
    <tile>
      <x>1</x>
      <y>3</y>
      <offsetX>0</offsetX>
      <offsetY>0</offsetY>
      <bitmap>gfx/safari/safari-floor.bmp</bitmap>
    </tile>
    <tile>
      <x>1</x>
      <y>4</y>
      <offsetX>0</offsetX>
      <offsetY>0</offsetY>
      <bitmap>gfx/safari/safari-floor.bmp</bitmap>
    </tile>
    <tile>
      <x>1</x>
      <y>5</y>
      <offsetX>0</offsetX>
      <offsetY>0</offsetY>
      <bitmap>gfx/safari/safari-floor.bmp</bitmap>
    </tile>
    <tile>
      <x>2</x>
      <y>0</y>
      <offsetX>0</offsetX>
      <offsetY>0</offsetY>
      <bitmap>gfx/safari/safari-floor.bmp</bitmap>
    </tile>
    <tile>
      <x>2</x>
      <y>1</y>
      <offsetX>0</offsetX>
      <offsetY>0</offsetY>
      <bitmap>gfx/safari/safari-floor.bmp</bitmap>
    </tile>
    <tile>
      <x>2</x>
      <y>2</y>
      <offsetX>0</offsetX>
      <offsetY>0</offsetY>
      <bitmap>gfx/safari/safari-floor.bmp</bitmap>
    </tile>
    <tile>
      <x>2</x>
      <y>3</y>
      <offsetX>0</offsetX>
      <offsetY>0</offsetY>
      <bitmap>gfx/safari/safari-floor.bmp</bitmap>
    </tile>
    <tile>
      <x>2</x>
      <y>4</y>
      <offsetX>0</offsetX>
      <offsetY>0</offsetY>
      <bitmap>gfx/safari/safari-floor.bmp</bitmap>
    </tile>
    <tile>
      <x>2</x>
      <y>5</y>
      <offsetX>0</offsetX>
      <offsetY>0</offsetY>
      <bitmap>gfx/safari/safari-floor.bmp</bitmap>
    </tile>
    <tile>
      <x>3</x>
      <y>0</y>
      <offsetX>0</offsetX>
      <offsetY>0</offsetY>
      <bitmap>gfx/safari/safari-floor.bmp</bitmap>
    </tile>
    <tile>
      <x>3</x>
      <y>1</y>
      <offsetX>0</offsetX>
      <offsetY>0</offsetY>
      <bitmap>gfx/safari/safari-floor.bmp</bitmap>
    </tile>
    <tile>
      <x>3</x>
      <y>2</y>
      <offsetX>0</offsetX>
      <offsetY>0</offsetY>
      <bitmap>gfx/safari/safari-floor.bmp</bitmap>
    </tile>
    <tile>
      <x>3</x>
      <y>3</y>
      <offsetX>0</offsetX>
      <offsetY>0</offsetY>
      <bitmap>gfx/safari/safari-floor.bmp</bitmap>
    </tile>
    <tile>
      <x>3</x>
      <y>4</y>
      <offsetX>0</offsetX>
      <offsetY>0</offsetY>
      <bitmap>gfx/safari/safari-floor.bmp</bitmap>
    </tile>
    <tile>
      <x>3</x>
      <y>5</y>
      <offsetX>0</offsetX>
      <offsetY>0</offsetY>
      <bitmap>gfx/safari/safari-floor.bmp</bitmap>
    </tile>
    <tile>
      <x>4</x>
      <y>0</y>
      <offsetX>0</offsetX>
      <offsetY>0</offsetY>
      <bitmap>gfx/safari/safari-floor.bmp</bitmap>
    </tile>
    <tile>
      <x>4</x>
      <y>1</y>
      <offsetX>0</offsetX>
      <offsetY>0</offsetY>
      <bitmap>gfx/safari/safari-floor.bmp</bitmap>
    </tile>
    <tile>
      <x>4</x>
      <y>2</y>
      <offsetX>0</offsetX>
      <offsetY>0</offsetY>
      <bitmap>gfx/safari/safari-floor.bmp</bitmap>
    </tile>
    <tile>
      <x>4</x>
      <y>3</y>
      <offsetX>0</offsetX>
      <offsetY>0</offsetY>
      <bitmap>gfx/safari/safari-floor.bmp</bitmap>
    </tile>
    <tile>
      <x>4</x>
      <y>4</y>
      <offsetX>0</offsetX>
      <offsetY>0</offsetY>
      <bitmap>gfx/safari/safari-floor.bmp</bitmap>
    </tile>
    <tile>
      <x>4</x>
      <y>5</y>
      <offsetX>0</offsetX>
      <offsetY>0</offsetY>
      <bitmap>gfx/safari/safari-floor.bmp</bitmap>
    </tile>
    <tile>
      <x>5</x>
      <y>0</y>
      <offsetX>0</offsetX>
      <offsetY>0</offsetY>
      <bitmap>gfx/safari/safari-floor.bmp</bitmap>
    </tile>
    <tile>
      <x>5</x>
      <y>1</y>
      <offsetX>0</offsetX>
      <offsetY>0</offsetY>
      <bitmap>gfx/safari/safari-floor.bmp</bitmap>
    </tile>
    <tile>
      <x>5</x>
      <y>2</y>
      <offsetX>0</offsetX>
      <offsetY>0</offsetY>
      <bitmap>gfx/safari/safari-floor.bmp</bitmap>
    </tile>
    <tile>
      <x>5</x>
      <y>3</y>
      <offsetX>0</offsetX>
      <offsetY>0</offsetY>
      <bitmap>gfx/safari/safari-floor.bmp</bitmap>
    </tile>
    <tile>
      <x>5</x>
      <y>4</y>
      <offsetX>0</offsetX>
      <offsetY>0</offsetY>
      <bitmap>gfx/safari/safari-floor.bmp</bitmap>
    </tile>
    <tile>
      <x>5</x>
      <y>5</y>
      <offsetX>0</offsetX>
      <offsetY>0</offsetY>
      <bitmap>gfx/safari/safari-floor.bmp</bitmap>
    </tile>
    <tile>
      <x>6</x>
      <y>0</y>
      <offsetX>0</offsetX>
      <offsetY>0</offsetY>
      <bitmap>gfx/safari/safari-floor.bmp</bitmap>
    </tile>
    <tile>
      <x>6</x>
      <y>1</y>
      <offsetX>0</offsetX>
      <offsetY>0</offsetY>
      <bitmap>gfx/safari/safari-floor.bmp</bitmap>
    </tile>
    <tile>
      <x>6</x>
      <y>2</y>
      <offsetX>0</offsetX>
      <offsetY>0</offsetY>
      <bitmap>gfx/safari/safari-floor.bmp</bitmap>
    </tile>
    <tile>
      <x>6</x>
      <y>3</y>
      <offsetX>0</offsetX>
      <offsetY>0</offsetY>
      <bitmap>gfx/safari/safari-floor.bmp</bitmap>
    </tile>
    <tile>
      <x>6</x>
      <y>4</y>
      <offsetX>0</offsetX>
      <offsetY>0</offsetY>
      <bitmap>gfx/safari/safari-floor.bmp</bitmap>
    </tile>
    <tile>
      <x>6</x>
      <y>5</y>
      <offsetX>0</offsetX>
      <offsetY>0</offsetY>
      <bitmap>gfx/safari/safari-floor.bmp</bitmap>
    </tile>
  </floor>

  <walls>
    <wall>
      <axis>x</axis>
      <index>1</index>
      <bitmap>gfx/safari/safari-wall-x-2.bmp</bitmap>
    </wall>
    <wall>
      <axis>x</axis>
      <index>2</index>
      <bitmap>gfx/safari/safari-wall-x-1.bmp</bitmap>
    </wall>
    <wall>
      <axis>x</axis>
      <index>3</index>
      <bitmap>gfx/safari/safari-wall-x-3.bmp</bitmap>
    </wall>
    <wall>
      <axis>x</axis>
      <index>4</index>
      <bitmap>gfx/safari/safari-wall-x-3.bmp</bitmap>
    </wall>
    <wall>
      <axis>x</axis>
      <index>5</index>
      <bitmap>gfx/safari/safari-wall-x-1.bmp</bitmap>
    </wall>
    <wall>
      <axis>x</axis>
      <index>6</index>
      <bitmap>gfx/safari/safari-wall-x-2.bmp</bitmap>
    </wall>
  </walls>

  <items>
    <item x="0" y="0" z="0">
      <label>301</label>
      <direction>none</direction>
      <behavior>0</behavior>
      <type>griditem</type>
    </item>
    <item x="0" y="1" z="0">
      <label>303</label>
      <direction>none</direction>
      <behavior>0</behavior>
      <type>griditem</type>
    </item>
    <item x="0" y="4" z="0">
      <label>303</label>
      <direction>none</direction>
      <behavior>0</behavior>
      <type>griditem</type>
    </item>
    <item x="0" y="5" z="0">
      <label>301</label>
      <direction>none</direction>
      <behavior>0</behavior>
      <type>griditem</type>
    </item>
    <item x="0" y="2" z="-1">
      <label>2077</label>
      <direction>north</direction>
      <behavior>0</behavior>
      <type>door</type>
    </item>
    <item x="7" y="2" z="-1">
      <label>3077</label>
      <direction>south</direction>
      <behavior>0</behavior>
      <type>door</type>
    </item>
    <item x="3" y="0" z="0">
      <label>28</label>
      <direction>south</direction>
      <behavior>0</behavior>
      <type>freeitem</type>
    </item>
    <item x="4" y="2" z="0">
      <label>28</label>
      <direction>south</direction>
      <behavior>0</behavior>
      <type>freeitem</type>
    </item>
    <item x="3" y="4" z="0">
      <label>28</label>
      <direction>south</direction>
      <behavior>0</behavior>
      <type>freeitem</type>
    </item>
    <item x="6" y="5" z="0">
      <label>41</label>
      <direction>none</direction>
      <behavior>14</behavior>
      <type>freeitem</type>
    </item>
  </items>

</room>
