<?xml version="1.0" encoding="UTF-8" standalone="no" ?>
<room xmlns:xsi="http://www.w3.org/2001/XMLSchema-instance" xsi:noNamespaceSchemaLocation="room.xsd">

  <name>moonbase/moonbase13.xml</name>

  <scenery>moonbase</scenery>

  <xTiles>5</xTiles>

  <yTiles>10</yTiles>

  <width>16</width>

  <floorType>regular</floorType>

  <floor>
    <tile>
      <x>0</x>
      <y>4</y>
      <offsetX>0</offsetX>
      <offsetY>0</offsetY>
      <bitmap>gfx/moonbase/moonbase-floor-north.bmp</bitmap>
    </tile>
    <tile>
      <x>0</x>
      <y>5</y>
      <offsetX>0</offsetX>
      <offsetY>0</offsetY>
      <bitmap>gfx/moonbase/moonbase-floor-north.bmp</bitmap>
    </tile>
    <tile>
      <x>2</x>
      <y>0</y>
      <offsetX>0</offsetX>
      <offsetY>0</offsetY>
      <bitmap>gfx/moonbase/moonbase-floor-east.bmp</bitmap>
    </tile>
    <tile>
      <x>3</x>
      <y>0</y>
      <offsetX>0</offsetX>
      <offsetY>0</offsetY>
      <bitmap>gfx/moonbase/moonbase-floor-east.bmp</bitmap>
    </tile>
    <tile>
      <x>1</x>
      <y>9</y>
      <offsetX>0</offsetX>
      <offsetY>0</offsetY>
      <bitmap>gfx/moonbase/moonbase-floor-west.bmp</bitmap>
    </tile>
    <tile>
      <x>2</x>
      <y>9</y>
      <offsetX>0</offsetX>
      <offsetY>0</offsetY>
      <bitmap>gfx/moonbase/moonbase-floor-west.bmp</bitmap>
    </tile>
    <tile>
      <x>3</x>
      <y>9</y>
      <offsetX>0</offsetX>
      <offsetY>0</offsetY>
      <bitmap>gfx/moonbase/moonbase-floor-west.bmp</bitmap>
    </tile>
    <tile>
      <x>4</x>
      <y>9</y>
      <offsetX>0</offsetX>
      <offsetY>0</offsetY>
      <bitmap>gfx/moonbase/moonbase-floor-west.bmp</bitmap>
    </tile>
    <tile>
      <x>1</x>
      <y>1</y>
      <offsetX>0</offsetX>
      <offsetY>0</offsetY>
      <bitmap>gfx/moonbase/moonbase-floor.bmp</bitmap>
    </tile>
    <tile>
      <x>1</x>
      <y>2</y>
      <offsetX>0</offsetX>
      <offsetY>0</offsetY>
      <bitmap>gfx/moonbase/moonbase-floor.bmp</bitmap>
    </tile>
    <tile>
      <x>1</x>
      <y>3</y>
      <offsetX>0</offsetX>
      <offsetY>0</offsetY>
      <bitmap>gfx/moonbase/moonbase-floor.bmp</bitmap>
    </tile>
    <tile>
      <x>1</x>
      <y>4</y>
      <offsetX>0</offsetX>
      <offsetY>0</offsetY>
      <bitmap>gfx/moonbase/moonbase-floor.bmp</bitmap>
    </tile>
    <tile>
      <x>1</x>
      <y>5</y>
      <offsetX>0</offsetX>
      <offsetY>0</offsetY>
      <bitmap>gfx/moonbase/moonbase-floor.bmp</bitmap>
    </tile>
    <tile>
      <x>1</x>
      <y>6</y>
      <offsetX>0</offsetX>
      <offsetY>0</offsetY>
      <bitmap>gfx/moonbase/moonbase-floor.bmp</bitmap>
    </tile>
    <tile>
      <x>1</x>
      <y>7</y>
      <offsetX>0</offsetX>
      <offsetY>0</offsetY>
      <bitmap>gfx/moonbase/moonbase-floor.bmp</bitmap>
    </tile>
    <tile>
      <x>1</x>
      <y>8</y>
      <offsetX>0</offsetX>
      <offsetY>0</offsetY>
      <bitmap>gfx/moonbase/moonbase-floor.bmp</bitmap>
    </tile>
    <tile>
      <x>2</x>
      <y>1</y>
      <offsetX>0</offsetX>
      <offsetY>0</offsetY>
      <bitmap>gfx/moonbase/moonbase-floor.bmp</bitmap>
    </tile>
    <tile>
      <x>2</x>
      <y>2</y>
      <offsetX>0</offsetX>
      <offsetY>0</offsetY>
      <bitmap>gfx/moonbase/moonbase-floor.bmp</bitmap>
    </tile>
    <tile>
      <x>2</x>
      <y>3</y>
      <offsetX>0</offsetX>
      <offsetY>0</offsetY>
      <bitmap>gfx/moonbase/moonbase-floor.bmp</bitmap>
    </tile>
    <tile>
      <x>2</x>
      <y>4</y>
      <offsetX>0</offsetX>
      <offsetY>0</offsetY>
      <bitmap>gfx/moonbase/moonbase-floor.bmp</bitmap>
    </tile>
    <tile>
      <x>2</x>
      <y>5</y>
      <offsetX>0</offsetX>
      <offsetY>0</offsetY>
      <bitmap>gfx/moonbase/moonbase-floor.bmp</bitmap>
    </tile>
    <tile>
      <x>2</x>
      <y>6</y>
      <offsetX>0</offsetX>
      <offsetY>0</offsetY>
      <bitmap>gfx/moonbase/moonbase-floor.bmp</bitmap>
    </tile>
    <tile>
      <x>2</x>
      <y>7</y>
      <offsetX>0</offsetX>
      <offsetY>0</offsetY>
      <bitmap>gfx/moonbase/moonbase-floor.bmp</bitmap>
    </tile>
    <tile>
      <x>2</x>
      <y>8</y>
      <offsetX>0</offsetX>
      <offsetY>0</offsetY>
      <bitmap>gfx/moonbase/moonbase-floor.bmp</bitmap>
    </tile>
    <tile>
      <x>3</x>
      <y>1</y>
      <offsetX>0</offsetX>
      <offsetY>0</offsetY>
      <bitmap>gfx/moonbase/moonbase-floor.bmp</bitmap>
    </tile>
    <tile>
      <x>3</x>
      <y>2</y>
      <offsetX>0</offsetX>
      <offsetY>0</offsetY>
      <bitmap>gfx/moonbase/moonbase-floor.bmp</bitmap>
    </tile>
    <tile>
      <x>3</x>
      <y>3</y>
      <offsetX>0</offsetX>
      <offsetY>0</offsetY>
      <bitmap>gfx/moonbase/moonbase-floor.bmp</bitmap>
    </tile>
    <tile>
      <x>3</x>
      <y>4</y>
      <offsetX>0</offsetX>
      <offsetY>0</offsetY>
      <bitmap>gfx/moonbase/moonbase-floor.bmp</bitmap>
    </tile>
    <tile>
      <x>3</x>
      <y>5</y>
      <offsetX>0</offsetX>
      <offsetY>0</offsetY>
      <bitmap>gfx/moonbase/moonbase-floor.bmp</bitmap>
    </tile>
    <tile>
      <x>3</x>
      <y>6</y>
      <offsetX>0</offsetX>
      <offsetY>0</offsetY>
      <bitmap>gfx/moonbase/moonbase-floor.bmp</bitmap>
    </tile>
    <tile>
      <x>3</x>
      <y>7</y>
      <offsetX>0</offsetX>
      <offsetY>0</offsetY>
      <bitmap>gfx/moonbase/moonbase-floor.bmp</bitmap>
    </tile>
    <tile>
      <x>3</x>
      <y>8</y>
      <offsetX>0</offsetX>
      <offsetY>0</offsetY>
      <bitmap>gfx/moonbase/moonbase-floor.bmp</bitmap>
    </tile>
    <tile>
      <x>4</x>
      <y>1</y>
      <offsetX>0</offsetX>
      <offsetY>0</offsetY>
      <bitmap>gfx/moonbase/moonbase-floor.bmp</bitmap>
    </tile>
    <tile>
      <x>4</x>
      <y>2</y>
      <offsetX>0</offsetX>
      <offsetY>0</offsetY>
      <bitmap>gfx/moonbase/moonbase-floor.bmp</bitmap>
    </tile>
    <tile>
      <x>4</x>
      <y>3</y>
      <offsetX>0</offsetX>
      <offsetY>0</offsetY>
      <bitmap>gfx/moonbase/moonbase-floor.bmp</bitmap>
    </tile>
    <tile>
      <x>4</x>
      <y>4</y>
      <offsetX>0</offsetX>
      <offsetY>0</offsetY>
      <bitmap>gfx/moonbase/moonbase-floor.bmp</bitmap>
    </tile>
    <tile>
      <x>4</x>
      <y>5</y>
      <offsetX>0</offsetX>
      <offsetY>0</offsetY>
      <bitmap>gfx/moonbase/moonbase-floor.bmp</bitmap>
    </tile>
    <tile>
      <x>4</x>
      <y>6</y>
      <offsetX>0</offsetX>
      <offsetY>0</offsetY>
      <bitmap>gfx/moonbase/moonbase-floor.bmp</bitmap>
    </tile>
    <tile>
      <x>4</x>
      <y>7</y>
      <offsetX>0</offsetX>
      <offsetY>0</offsetY>
      <bitmap>gfx/moonbase/moonbase-floor.bmp</bitmap>
    </tile>
    <tile>
      <x>4</x>
      <y>8</y>
      <offsetX>0</offsetX>
      <offsetY>0</offsetY>
      <bitmap>gfx/moonbase/moonbase-floor.bmp</bitmap>
    </tile>
  </floor>

  <items>
    <item x="0" y="1" z="0">
      <label>257</label>
      <direction>none</direction>
      <behavior>0</behavior>
      <type>griditem</type>
    </item>
    <item x="0" y="2" z="0">
      <label>251</label>
      <direction>none</direction>
      <behavior>0</behavior>
      <type>griditem</type>
    </item>
    <item x="0" y="3" z="0">
      <label>255</label>
      <direction>none</direction>
      <behavior>0</behavior>
      <type>griditem</type>
    </item>
    <item x="0" y="6" z="0">
      <label>255</label>
      <direction>none</direction>
      <behavior>0</behavior>
      <type>griditem</type>
    </item>
    <item x="0" y="7" z="0">
      <label>251</label>
      <direction>none</direction>
      <behavior>0</behavior>
      <type>griditem</type>
    </item>
    <item x="0" y="8" z="0">
      <label>253</label>
      <direction>none</direction>
      <behavior>0</behavior>
      <type>griditem</type>
    </item>
    <item x="0" y="4" z="-1">
      <label>2033</label>
      <direction>north</direction>
      <behavior>0</behavior>
      <type>door</type>
    </item>
    <item x="1" y="0" z="0">
      <label>256</label>
      <direction>none</direction>
      <behavior>0</behavior>
      <type>griditem</type>
    </item>
    <item x="4" y="0" z="0">
      <label>254</label>
      <direction>none</direction>
      <behavior>0</behavior>
      <type>griditem</type>
    </item>
    <item x="2" y="0" z="-1">
      <label>4033</label>
      <direction>east</direction>
      <behavior>0</behavior>
      <type>door</type>
    </item>
    <item x="2" y="9" z="-1">
      <label>5033</label>
      <direction>west</direction>
      <behavior>0</behavior>
      <type>door</type>
    </item>
    <item x="4" y="3" z="0">
      <label>4</label>
      <direction>west</direction>
      <behavior>0</behavior>
      <type>griditem</type>
    </item>
    <item x="4" y="3" z="1">
      <label>27</label>
      <direction>north</direction>
      <behavior>0</behavior>
      <type>freeitem</type>
    </item>
    <item x="4" y="4" z="0">
      <label>4</label>
      <direction>west</direction>
      <behavior>0</behavior>
      <type>griditem</type>
    </item>
    <item x="4" y="4" z="1">
      <label>27</label>
      <direction>north</direction>
      <behavior>0</behavior>
      <type>freeitem</type>
    </item>
    <item x="4" y="5" z="0">
      <label>4</label>
      <direction>west</direction>
      <behavior>0</behavior>
      <type>griditem</type>
    </item>
    <item x="4" y="5" z="1">
      <label>27</label>
      <direction>north</direction>
      <behavior>0</behavior>
      <type>freeitem</type>
    </item>
    <item x="4" y="6" z="0">
      <label>4</label>
      <direction>west</direction>
      <behavior>0</behavior>
      <type>griditem</type>
    </item>
    <item x="4" y="6" z="1">
      <label>27</label>
      <direction>north</direction>
      <behavior>0</behavior>
      <type>freeitem</type>
    </item>
  </items>

</room>
